{
  "schemaVersion": "1.0",
  "sourceLocale": "en",
  "sourceRevision": "en-752ecc5b2364",
  "sourceChecksum": "752ecc5b2364a44691dbb204ebc3817b84cfefeea181c65cb783ed78762b6451",
  "expectedMessageCount": 2922,
  "locales": [
    {
      "code": "en",
      "englishName": "English",
      "nativeName": "English",
      "direction": "ltr",
      "runtimePublicationStatus": "published",
      "targetSourceRevision": "en-752ecc5b2364",
      "expectedMessageCount": 2922,
      "translationStatus": "source-locale",
      "dictionaryPath": "app/i18n/generated/en.source.json",
      "dictionaryChecksum": "752ecc5b2364a44691dbb204ebc3817b84cfefeea181c65cb783ed78762b6451",
      "linguisticReviewStatus": "not-applicable-source-locale",
      "reviewer": null,
      "reviewedRevision": null,
      "reviewedDictionaryChecksum": null,
      "reviewApproval": null,
      "missingMessagePolicy": "source-locale",
      "eligibleForRouting": true,
      "eligibleForHreflang": true,
      "eligibleForSitemap": true,
      "publicationGate": "existing-source-locale"
    },
    {
      "code": "fr",
      "englishName": "French",
      "nativeName": "Français",
      "direction": "ltr",
      "runtimePublicationStatus": "pending-linguistic-review",
      "targetSourceRevision": "en-752ecc5b2364",
      "expectedMessageCount": 2922,
      "translationStatus": "ai-draft-generated-private",
      "dictionaryPath": null,
      "dictionaryChecksum": null,
      "linguisticReviewStatus": "not-started",
      "reviewer": null,
      "reviewedRevision": null,
      "reviewedDictionaryChecksum": null,
      "reviewApproval": null,
      "missingMessagePolicy": "fail-closed-no-fallback",
      "eligibleForRouting": false,
      "eligibleForHreflang": false,
      "eligibleForSitemap": false,
      "publicationGate": "closed"
    },
    {
      "code": "es",
      "englishName": "Spanish",
      "nativeName": "Español",
      "direction": "ltr",
      "runtimePublicationStatus": "pending-linguistic-review",
      "targetSourceRevision": "en-752ecc5b2364",
      "expectedMessageCount": 2922,
      "translationStatus": "ai-draft-generated-private",
      "dictionaryPath": null,
      "dictionaryChecksum": null,
      "linguisticReviewStatus": "not-started",
      "reviewer": null,
      "reviewedRevision": null,
      "reviewedDictionaryChecksum": null,
      "reviewApproval": null,
      "missingMessagePolicy": "fail-closed-no-fallback",
      "eligibleForRouting": false,
      "eligibleForHreflang": false,
      "eligibleForSitemap": false,
      "publicationGate": "closed"
    },
    {
      "code": "pt",
      "englishName": "Portuguese",
      "nativeName": "Português",
      "direction": "ltr",
      "runtimePublicationStatus": "pending-linguistic-review",
      "targetSourceRevision": "en-752ecc5b2364",
      "expectedMessageCount": 2922,
      "translationStatus": "ai-draft-generated-private",
      "dictionaryPath": null,
      "dictionaryChecksum": null,
      "linguisticReviewStatus": "not-started",
      "reviewer": null,
      "reviewedRevision": null,
      "reviewedDictionaryChecksum": null,
      "reviewApproval": null,
      "missingMessagePolicy": "fail-closed-no-fallback",
      "eligibleForRouting": false,
      "eligibleForHreflang": false,
      "eligibleForSitemap": false,
      "publicationGate": "closed"
    },
    {
      "code": "it",
      "englishName": "Italian",
      "nativeName": "Italiano",
      "direction": "ltr",
      "runtimePublicationStatus": "pending-linguistic-review",
      "targetSourceRevision": "en-752ecc5b2364",
      "expectedMessageCount": 2922,
      "translationStatus": "ai-draft-generated-private",
      "dictionaryPath": null,
      "dictionaryChecksum": null,
      "linguisticReviewStatus": "not-started",
      "reviewer": null,
      "reviewedRevision": null,
      "reviewedDictionaryChecksum": null,
      "reviewApproval": null,
      "missingMessagePolicy": "fail-closed-no-fallback",
      "eligibleForRouting": false,
      "eligibleForHreflang": false,
      "eligibleForSitemap": false,
      "publicationGate": "closed"
    },
    {
      "code": "nl",
      "englishName": "Dutch",
      "nativeName": "Nederlands",
      "direction": "ltr",
      "runtimePublicationStatus": "pending-linguistic-review",
      "targetSourceRevision": "en-752ecc5b2364",
      "expectedMessageCount": 2922,
      "translationStatus": "ai-draft-generated-private",
      "dictionaryPath": null,
      "dictionaryChecksum": null,
      "linguisticReviewStatus": "not-started",
      "reviewer": null,
      "reviewedRevision": null,
      "reviewedDictionaryChecksum": null,
      "reviewApproval": null,
      "missingMessagePolicy": "fail-closed-no-fallback",
      "eligibleForRouting": false,
      "eligibleForHreflang": false,
      "eligibleForSitemap": false,
      "publicationGate": "closed"
    },
    {
      "code": "id",
      "englishName": "Indonesian",
      "nativeName": "Bahasa Indonesia",
      "direction": "ltr",
      "runtimePublicationStatus": "pending-linguistic-review",
      "targetSourceRevision": "en-752ecc5b2364",
      "expectedMessageCount": 2922,
      "translationStatus": "ai-draft-generated-private",
      "dictionaryPath": null,
      "dictionaryChecksum": null,
      "linguisticReviewStatus": "not-started",
      "reviewer": null,
      "reviewedRevision": null,
      "reviewedDictionaryChecksum": null,
      "reviewApproval": null,
      "missingMessagePolicy": "fail-closed-no-fallback",
      "eligibleForRouting": false,
      "eligibleForHreflang": false,
      "eligibleForSitemap": false,
      "publicationGate": "closed"
    },
    {
      "code": "de",
      "englishName": "German",
      "nativeName": "Deutsch",
      "direction": "ltr",
      "runtimePublicationStatus": "pending-linguistic-review",
      "targetSourceRevision": "en-752ecc5b2364",
      "expectedMessageCount": 2922,
      "translationStatus": "ai-draft-generated-private",
      "dictionaryPath": null,
      "dictionaryChecksum": null,
      "linguisticReviewStatus": "not-started",
      "reviewer": null,
      "reviewedRevision": null,
      "reviewedDictionaryChecksum": null,
      "reviewApproval": null,
      "missingMessagePolicy": "fail-closed-no-fallback",
      "eligibleForRouting": false,
      "eligibleForHreflang": false,
      "eligibleForSitemap": false,
      "publicationGate": "closed"
    },
    {
      "code": "pl",
      "englishName": "Polish",
      "nativeName": "Polski",
      "direction": "ltr",
      "runtimePublicationStatus": "pending-linguistic-review",
      "targetSourceRevision": "en-752ecc5b2364",
      "expectedMessageCount": 2922,
      "translationStatus": "ai-draft-generated-private",
      "dictionaryPath": null,
      "dictionaryChecksum": null,
      "linguisticReviewStatus": "not-started",
      "reviewer": null,
      "reviewedRevision": null,
      "reviewedDictionaryChecksum": null,
      "reviewApproval": null,
      "missingMessagePolicy": "fail-closed-no-fallback",
      "eligibleForRouting": false,
      "eligibleForHreflang": false,
      "eligibleForSitemap": false,
      "publicationGate": "closed"
    },
    {
      "code": "tr",
      "englishName": "Turkish",
      "nativeName": "Türkçe",
      "direction": "ltr",
      "runtimePublicationStatus": "pending-linguistic-review",
      "targetSourceRevision": "en-752ecc5b2364",
      "expectedMessageCount": 2922,
      "translationStatus": "ai-draft-generated-private",
      "dictionaryPath": null,
      "dictionaryChecksum": null,
      "linguisticReviewStatus": "not-started",
      "reviewer": null,
      "reviewedRevision": null,
      "reviewedDictionaryChecksum": null,
      "reviewApproval": null,
      "missingMessagePolicy": "fail-closed-no-fallback",
      "eligibleForRouting": false,
      "eligibleForHreflang": false,
      "eligibleForSitemap": false,
      "publicationGate": "closed"
    },
    {
      "code": "vi",
      "englishName": "Vietnamese",
      "nativeName": "Tiếng Việt",
      "direction": "ltr",
      "runtimePublicationStatus": "pending-linguistic-review",
      "targetSourceRevision": "en-752ecc5b2364",
      "expectedMessageCount": 2922,
      "translationStatus": "ai-draft-generated-private",
      "dictionaryPath": null,
      "dictionaryChecksum": null,
      "linguisticReviewStatus": "not-started",
      "reviewer": null,
      "reviewedRevision": null,
      "reviewedDictionaryChecksum": null,
      "reviewApproval": null,
      "missingMessagePolicy": "fail-closed-no-fallback",
      "eligibleForRouting": false,
      "eligibleForHreflang": false,
      "eligibleForSitemap": false,
      "publicationGate": "closed"
    },
    {
      "code": "ja",
      "englishName": "Japanese",
      "nativeName": "日本語",
      "direction": "ltr",
      "runtimePublicationStatus": "pending-linguistic-review",
      "targetSourceRevision": "en-752ecc5b2364",
      "expectedMessageCount": 2922,
      "translationStatus": "ai-draft-generated-private",
      "dictionaryPath": null,
      "dictionaryChecksum": null,
      "linguisticReviewStatus": "not-started",
      "reviewer": null,
      "reviewedRevision": null,
      "reviewedDictionaryChecksum": null,
      "reviewApproval": null,
      "missingMessagePolicy": "fail-closed-no-fallback",
      "eligibleForRouting": false,
      "eligibleForHreflang": false,
      "eligibleForSitemap": false,
      "publicationGate": "closed"
    },
    {
      "code": "zh-Hans",
      "englishName": "Simplified Chinese",
      "nativeName": "简体中文",
      "direction": "ltr",
      "runtimePublicationStatus": "pending-linguistic-review",
      "targetSourceRevision": "en-752ecc5b2364",
      "expectedMessageCount": 2922,
      "translationStatus": "ai-draft-generated-private",
      "dictionaryPath": null,
      "dictionaryChecksum": null,
      "linguisticReviewStatus": "not-started",
      "reviewer": null,
      "reviewedRevision": null,